{
    "schema": "ThreatConfirmedEvent@2",
    "eventId": "evt_01HW4RQYT1ZPQ3XJ9B7MNAA002",
    "confidence": 9333,
    "pattern": "flash_loan_oracle",
    "attackerAddresses": ["0xabcdef1234567890abcdef1234567890abcdef12"],
    "victimProtocol": "0x1111111111111111111111111111111111111111",
    "triggeringTxHashes": ["0x7f5c81b53c20e1b2a6f9b4a8f1d2e3c4b5a69788fedcba0987654321abcdef01"],
    "observedAtBlock": 19824711,
    "timestamp": "2026-04-17T14:32:17.500Z",
    "observations": 4,
    "anomalyScore": 0.86,
    "sequenceScore": 0.92,
    "federation": {
        "consensusK": 2,
        "consensusN": 3,
        "operatorAttestations": [
            {
                "operatorId": "alpha",
                "modelHash": "0xa9f05c04e2d6297d041947fb757f692f6bc0b1489b7b8d4bd2190c3ad1d4a81d",
                "confidence": 9500,
                "anomalyScore": 0.87,
                "sequenceScore": 0.93,
                "state": "CONFIRMED",
                "level": "confirmed",
                "observations": 4,
                "observedAt": "2026-04-17T14:32:17.128Z"
            },
            {
                "operatorId": "beta",
                "modelHash": "0xb2c3d4e5f6a7b8c9d0e1f2a3b4c5d6e7f8091a2b3c4d5e6f7a8b9c0d1e2f3a4b",
                "confidence": 9166,
                "anomalyScore": 0.85,
                "sequenceScore": 0.91,
                "state": "CONFIRMED",
                "level": "confirmed",
                "observations": 4,
                "observedAt": "2026-04-17T14:32:17.410Z"
            }
        ]
    }
}
